<!-- java-ml.dtd 0.96 -->
<!-- Copyright (C) 2000, Greg J. Badros <gjb@cs.washington.edu> -->
<!-- A DTD for JavaML, an XML representation of Java Source Code -->
<!-- http://www.cs.washington.edu/homes/gjb/papers/javaml/javaml.html -->

<!ENTITY % visibility-attribute "visibility (public|private|protected) #IMPLIED">
<!ENTITY % interface-visibility-attribute "visibility (public) #IMPLIED">
<!ENTITY % kind-attribute "kind (integer|long|float|double) #IMPLIED">
<!ENTITY % mod-final "final CDATA #IMPLIED">
<!ENTITY % mod-static "static CDATA #IMPLIED">
<!ENTITY % mod-volatile "volatile CDATA #IMPLIED">
<!ENTITY % mod-transient "transient CDATA #IMPLIED">
<!ENTITY % mod-native "native CDATA #IMPLIED">
<!ENTITY % mod-abstract "abstract CDATA #IMPLIED">
<!ENTITY % mod-synchronized "synchronized CDATA #IMPLIED">
<!ENTITY % location-info 
	"line CDATA #IMPLIED col CDATA #IMPLIED 
         end-line CDATA #IMPLIED end-col CDATA #IMPLIED
	 comment CDATA #IMPLIED">
<!ENTITY % expr-elems "send|new|new-array|var-ref|field-access|array-ref|paren|assignment-expr|conditional-expr|binary-expr|unary-expr|cast-expr|instanceof-test|literal-number|literal-string|literal-char|literal-boolean|literal-null|this|super">
<!ENTITY % stmt-elems "block|local-variable|try|throw|if|switch|loop|do-loop|return|continue|break|synchronized|%expr-elems;">

<!ELEMENT code-fragment ANY>
<!ELEMENT result ANY>
<!ELEMENT java-source-program (java-class-file+)>
<!ELEMENT java-class-file (package-decl?,import*,(class|interface)+) >
<!ATTLIST java-class-file
    name CDATA #IMPLIED
    version CDATA #IMPLIED>
<!ELEMENT import EMPTY>
<!ATTLIST import
    module CDATA #REQUIRED>
<!ELEMENT class (superclass?, implement*, (class|interface|constructor|method|field|static-initializer|instance-initializer)*) >
<!ATTLIST class
    name CDATA #REQUIRED
    %visibility-attribute;
    %mod-static;
    %mod-abstract;
    %mod-final;
    %mod-synchronized;
    %location-info;>
<!ELEMENT anonymous-class (superclass?, implement*, (constructor|method|field|instance-initializer)*) >
<!ATTLIST anonymous-class
    %mod-abstract;
    %mod-final;
    %mod-synchronized;
    %location-info;>
<!ELEMENT superclass EMPTY>
<!ATTLIST superclass
    name CDATA #REQUIRED>
<!ELEMENT interface (extend*, (method|field)*) >
<!ATTLIST interface
    name CDATA #REQUIRED
    %interface-visibility-attribute;
    %location-info;>
<!ELEMENT implement EMPTY>
<!ATTLIST implement
    interface CDATA #REQUIRED>
<!ELEMENT extend EMPTY>
<!ATTLIST extend
    interface CDATA #REQUIRED>
<!ELEMENT field (type,(array-initializer|%expr-elems;)?)>
<!ATTLIST field
    name CDATA #REQUIRED
    %visibility-attribute;
    %mod-final;
    %mod-static;
    %mod-volatile;
    %mod-transient;
    %location-info;>
<!ELEMENT constructor (formal-arguments,throws*,(super-call|this-call)?,(%stmt-elems;)?)>
<!ATTLIST constructor
    name CDATA #REQUIRED
    id ID #REQUIRED
    %visibility-attribute;
    %mod-final;
    %mod-static;
    %mod-synchronized;
    %mod-volatile;
    %mod-transient;
    %mod-native;
    %location-info;>
<!ELEMENT method (type,formal-arguments,throws*,(%stmt-elems;)?)>
<!ATTLIST method 
    name CDATA #REQUIRED
    id ID #REQUIRED
    %visibility-attribute;
    %mod-abstract;
    %mod-final;
    %mod-static;
    %mod-synchronized;
    %mod-volatile;
    %mod-transient;
    %mod-native;
    %location-info;>
<!ELEMENT formal-arguments (formal-argument)*>
<!ELEMENT formal-argument (type)>
<!ATTLIST formal-argument
    name CDATA #REQUIRED
    id ID #REQUIRED
    %mod-final;>
<!ELEMENT send (target?,arguments)>
<!ATTLIST send
    message CDATA #REQUIRED
    idref IDREF #IMPLIED>
<!ELEMENT block (label*,(%stmt-elems;)*)>
<!ATTLIST block
    %location-info;>
<!ELEMENT label EMPTY>
<!ATTLIST label
    name CDATA #REQUIRED>
<!ELEMENT target (%expr-elems;)>
<!ELEMENT return (%expr-elems;)?>
<!ELEMENT throw (%expr-elems;)>
<!ELEMENT throws EMPTY>
<!ATTLIST throws
    exception CDATA #REQUIRED>
<!ELEMENT new (type,arguments,anonymous-class?)>
<!ELEMENT type EMPTY>
<!ATTLIST type
    primitive CDATA #IMPLIED
    name CDATA #REQUIRED
    dimensions CDATA #IMPLIED
    idref IDREF #IMPLIED>
<!ELEMENT new-array (type,dim-expr*,array-initializer?)>
<!ATTLIST new-array
    dimensions CDATA #REQUIRED>
<!ELEMENT dim-expr (%expr-elems;)>
<!ELEMENT local-variable (type,(static-initializer|array-initializer|%expr-elems;)?)>
<!ATTLIST local-variable
    name CDATA #REQUIRED
    id ID #REQUIRED
    continued CDATA #IMPLIED
    %mod-final;>
<!ELEMENT array-initializer (array-initializer|%expr-elems;)*>
<!ATTLIST array-initializer
    length CDATA #REQUIRED>
<!ELEMENT arguments (%expr-elems;)*>
<!ELEMENT literal-string EMPTY>
<!ATTLIST literal-string
    value CDATA #REQUIRED>
<!ELEMENT literal-char EMPTY>
<!ATTLIST literal-char
    value CDATA #REQUIRED>
<!ELEMENT literal-number EMPTY>
<!ATTLIST literal-number
    value CDATA #REQUIRED
    %kind-attribute;
    base CDATA "10">
<!ELEMENT var-ref EMPTY>
<!ATTLIST var-ref
    name CDATA #REQUIRED
    idref IDREF #IMPLIED>
<!ELEMENT field-access (%expr-elems;)>
<!ATTLIST field-access
    field CDATA #REQUIRED>
<!ELEMENT var-set EMPTY>
<!ATTLIST var-set
    name CDATA #REQUIRED>
<!ELEMENT field-set (%expr-elems;)>
<!ATTLIST field-set
    field CDATA #REQUIRED>
<!ELEMENT package-decl EMPTY>
<!ATTLIST package-decl
    name CDATA #REQUIRED>
<!ELEMENT assignment-expr (lvalue,(%expr-elems;))>
<!ATTLIST assignment-expr
    op CDATA #REQUIRED>
<!ELEMENT lvalue (var-set|field-set|%expr-elems;)>
<!ELEMENT instanceof-test ((%expr-elems;),type)>
<!ELEMENT binary-expr ((%expr-elems;),(%expr-elems;))>
<!ATTLIST binary-expr
    op CDATA #REQUIRED>
<!ELEMENT paren (%expr-elems;)>
<!ELEMENT unary-expr (%expr-elems;)>
<!ATTLIST unary-expr
    op CDATA #REQUIRED
    post (true|false) #IMPLIED>
<!ELEMENT cast-expr (type,(%expr-elems;))>
<!ELEMENT literal-boolean EMPTY>
<!ATTLIST literal-boolean
    value (true|false) #REQUIRED>
<!ELEMENT literal-null EMPTY>
<!ELEMENT synchronized (expr,block)>
<!ELEMENT expr (%expr-elems;)>
<!ELEMENT if (test,true-case,false-case?)>
<!ELEMENT test (%expr-elems;)>
<!ELEMENT true-case (%stmt-elems;)?>
<!ELEMENT false-case (%stmt-elems;)?>
<!ELEMENT array-ref (base,offset)>
<!ELEMENT base (%expr-elems;)>
<!ELEMENT offset (%expr-elems;)>
<!ELEMENT static-initializer (%stmt-elems;)*>
<!ELEMENT instance-initializer (%stmt-elems;)*>
<!ELEMENT super-call (arguments)>
<!ELEMENT this-call (arguments)>
<!ELEMENT super EMPTY>
<!ELEMENT this EMPTY>
<!ELEMENT loop (init*,test?,update*,(%stmt-elems;)?)>
<!ATTLIST loop
    kind (for|while) #IMPLIED
    %location-info;>
<!ELEMENT init (local-variable|%expr-elems;)*>
<!ELEMENT update (%expr-elems;)>
<!ELEMENT do-loop ((%stmt-elems;)?,test?)>
<!ELEMENT try ((%stmt-elems;),catch*,finally?)>
<!ELEMENT catch (formal-argument,(%stmt-elems;)?)>
<!ELEMENT finally (%stmt-elems;)>
<!ELEMENT continue EMPTY>
<!ATTLIST continue
    targetname CDATA #IMPLIED>
<!ELEMENT break EMPTY>
<!ATTLIST break
    targetname CDATA #IMPLIED>
<!ELEMENT conditional-expr ((%expr-elems;),(%expr-elems;),(%expr-elems;))>
<!ELEMENT switch ((%expr-elems;),switch-block+)>
<!ELEMENT switch-block ((case|default-case)+,(%stmt-elems;)*)>
<!ELEMENT case (%expr-elems;)>
<!ELEMENT default-case EMPTY>
